{
  "$schema": "https://json-schema.org/draft/2020-12/schema",
  "$id": "https://schemas.movie-platform.dev/ci/container-vulnerability-exemption-v1alpha1.schema.json",
  "title": "Container vulnerability exemption v1alpha1",
  "description": "Closed platform governance around one OpenVEX 0.2.0 statement. Schema validity is not approval; cross-field identity, lifetime and trusted-source checks are mandatory.",
  "type": "object",
  "properties": {
    "apiVersion": {
      "const": "ci.movie-platform.dev/exemptions/v1alpha1"
    },
    "id": {
      "type": "string",
      "maxLength": 64,
      "pattern": "^EX-[A-Za-z0-9][A-Za-z0-9-]{0,60}$"
    },
    "component": {
      "enum": [
        "reservation-agent",
        "recommendation-service",
        "reservation-mcp",
        "recommendation-mcp",
        "reservation-web",
        "reservation-service"
      ]
    },
    "type": {
      "enum": [
        "not-affected",
        "risk-accepted"
      ]
    },
    "package": {
      "type": "object",
      "properties": {
        "name": {
          "type": "string",
          "minLength": 1,
          "maxLength": 256,
          "pattern": "^[^\\s\\u0000-\\u001f\\u007f](?:[^\\u0000-\\u001f\\u007f]*[^\\s\\u0000-\\u001f\\u007f])?$"
        },
        "version": {
          "type": "string",
          "minLength": 1,
          "maxLength": 256,
          "pattern": "^[^\\s\\u0000-\\u001f\\u007f](?:[^\\u0000-\\u001f\\u007f]*[^\\s\\u0000-\\u001f\\u007f])?$"
        },
        "purl": {
          "type": "string",
          "minLength": 1,
          "maxLength": 2048,
          "pattern": "^pkg:[a-z][a-z0-9.+-]*/[^@?#\\s*\\\\]+@[^@?#\\s*\\\\]+(?:\\?[^#\\s*\\\\]+)?$"
        }
      },
      "required": [
        "name",
        "version",
        "purl"
      ],
      "additionalProperties": false
    },
    "platform": {
      "type": "object",
      "properties": {
        "os": {
          "const": "linux"
        },
        "architecture": {
          "const": "amd64"
        }
      },
      "required": [
        "os",
        "architecture"
      ],
      "additionalProperties": false
    },
    "owner": {
      "type": "string",
      "minLength": 1,
      "maxLength": 256,
      "pattern": "^[^\\s\\u0000-\\u001f\\u007f](?:[^\\u0000-\\u001f\\u007f]*[^\\s\\u0000-\\u001f\\u007f])?$"
    },
    "createdAt": {
      "type": "string",
      "format": "date-time",
      "pattern": "^[0-9]{4}-[0-9]{2}-[0-9]{2}T[0-9]{2}:[0-9]{2}:[0-9]{2}Z$"
    },
    "approval": {
      "type": "object",
      "properties": {
        "by": {
          "type": "string",
          "minLength": 1,
          "maxLength": 256,
          "pattern": "^[^\\s\\u0000-\\u001f\\u007f](?:[^\\u0000-\\u001f\\u007f]*[^\\s\\u0000-\\u001f\\u007f])?$"
        },
        "at": {
          "type": "string",
          "format": "date-time",
          "pattern": "^[0-9]{4}-[0-9]{2}-[0-9]{2}T[0-9]{2}:[0-9]{2}:[0-9]{2}Z$"
        },
        "reference": {
          "type": "string",
          "minLength": 1,
          "maxLength": 2048,
          "pattern": "^https://github\\.com/movie-reservation-platform-lab/movie-platform-actions/pull/[1-9][0-9]*$",
          "format": "uri"
        }
      },
      "required": [
        "by",
        "at",
        "reference"
      ],
      "additionalProperties": false
    },
    "expiresAt": {
      "type": "string",
      "format": "date-time",
      "pattern": "^[0-9]{4}-[0-9]{2}-[0-9]{2}T[0-9]{2}:[0-9]{2}:[0-9]{2}Z$"
    },
    "rationale": {
      "type": "string",
      "minLength": 1,
      "maxLength": 2048,
      "pattern": "^[^\\s\\u0000-\\u001f\\u007f](?:[^\\u0000-\\u001f\\u007f]*[^\\s\\u0000-\\u001f\\u007f])?$"
    },
    "references": {
      "type": "array",
      "items": {
        "type": "string",
        "minLength": 1,
        "maxLength": 2048,
        "pattern": "^https://[^\\s#]+$",
        "format": "uri"
      },
      "minItems": 1,
      "maxItems": 8,
      "uniqueItems": true
    },
    "vex": {
      "type": "object",
      "properties": {
        "@context": {
          "const": "https://openvex.dev/ns/v0.2.0"
        },
        "@id": {
          "type": "string",
          "maxLength": 94,
          "pattern": "^urn:movie-platform:exemption:EX-[A-Za-z0-9][A-Za-z0-9-]{0,60}$"
        },
        "author": {
          "type": "string",
          "minLength": 1,
          "maxLength": 256,
          "pattern": "^[^\\s\\u0000-\\u001f\\u007f](?:[^\\u0000-\\u001f\\u007f]*[^\\s\\u0000-\\u001f\\u007f])?$"
        },
        "timestamp": {
          "type": "string",
          "format": "date-time",
          "pattern": "^[0-9]{4}-[0-9]{2}-[0-9]{2}T[0-9]{2}:[0-9]{2}:[0-9]{2}Z$"
        },
        "version": {
          "type": "integer",
          "minimum": 1,
          "maximum": 9007199254740991
        },
        "statements": {
          "type": "array",
          "items": {
            "oneOf": [
              {
                "type": "object",
                "properties": {
                  "vulnerability": {
                    "type": "object",
                    "properties": {
                      "name": {
                        "type": "string",
                        "maxLength": 64,
                        "pattern": "^CVE-[0-9]{4}-[0-9]{4,}$"
                      }
                    },
                    "required": [
                      "name"
                    ],
                    "additionalProperties": false
                  },
                  "products": {
                    "type": "array",
                    "items": {
                      "type": "object",
                      "properties": {
                        "@id": {
                          "type": "string",
                          "minLength": 1,
                          "maxLength": 2048,
                          "pattern": "^https://[^\\s#]+$",
                          "format": "uri"
                        },
                        "subcomponents": {
                          "type": "array",
                          "items": {
                            "type": "object",
                            "properties": {
                              "@id": {
                                "type": "string",
                                "minLength": 1,
                                "maxLength": 2048,
                                "pattern": "^pkg:[a-z][a-z0-9.+-]*/[^@?#\\s*\\\\]+@[^@?#\\s*\\\\]+(?:\\?[^#\\s*\\\\]+)?$"
                              }
                            },
                            "required": [
                              "@id"
                            ],
                            "additionalProperties": false
                          },
                          "minItems": 1,
                          "maxItems": 1
                        }
                      },
                      "required": [
                        "@id",
                        "subcomponents"
                      ],
                      "additionalProperties": false
                    },
                    "minItems": 1,
                    "maxItems": 1
                  },
                  "status": {
                    "const": "not_affected"
                  },
                  "justification": {
                    "enum": [
                      "component_not_present",
                      "vulnerable_code_not_present",
                      "vulnerable_code_not_in_execute_path",
                      "vulnerable_code_cannot_be_controlled_by_adversary",
                      "inline_mitigations_already_exist"
                    ]
                  },
                  "impact_statement": {
                    "type": "string",
                    "minLength": 1,
                    "maxLength": 2048,
                    "pattern": "^[^\\s\\u0000-\\u001f\\u007f](?:[^\\u0000-\\u001f\\u007f]*[^\\s\\u0000-\\u001f\\u007f])?$"
                  }
                },
                "required": [
                  "vulnerability",
                  "products",
                  "status",
                  "justification",
                  "impact_statement"
                ],
                "additionalProperties": false
              },
              {
                "type": "object",
                "properties": {
                  "vulnerability": {
                    "type": "object",
                    "properties": {
                      "name": {
                        "type": "string",
                        "maxLength": 64,
                        "pattern": "^CVE-[0-9]{4}-[0-9]{4,}$"
                      }
                    },
                    "required": [
                      "name"
                    ],
                    "additionalProperties": false
                  },
                  "products": {
                    "type": "array",
                    "items": {
                      "type": "object",
                      "properties": {
                        "@id": {
                          "type": "string",
                          "minLength": 1,
                          "maxLength": 2048,
                          "pattern": "^https://[^\\s#]+$",
                          "format": "uri"
                        },
                        "subcomponents": {
                          "type": "array",
                          "items": {
                            "type": "object",
                            "properties": {
                              "@id": {
                                "type": "string",
                                "minLength": 1,
                                "maxLength": 2048,
                                "pattern": "^pkg:[a-z][a-z0-9.+-]*/[^@?#\\s*\\\\]+@[^@?#\\s*\\\\]+(?:\\?[^#\\s*\\\\]+)?$"
                              }
                            },
                            "required": [
                              "@id"
                            ],
                            "additionalProperties": false
                          },
                          "minItems": 1,
                          "maxItems": 1
                        }
                      },
                      "required": [
                        "@id",
                        "subcomponents"
                      ],
                      "additionalProperties": false
                    },
                    "minItems": 1,
                    "maxItems": 1
                  },
                  "status": {
                    "const": "affected"
                  },
                  "action_statement": {
                    "type": "string",
                    "minLength": 1,
                    "maxLength": 2048,
                    "pattern": "^[^\\s\\u0000-\\u001f\\u007f](?:[^\\u0000-\\u001f\\u007f]*[^\\s\\u0000-\\u001f\\u007f])?$"
                  }
                },
                "required": [
                  "vulnerability",
                  "products",
                  "status",
                  "action_statement"
                ],
                "additionalProperties": false
              }
            ]
          },
          "minItems": 1,
          "maxItems": 1
        }
      },
      "required": [
        "@context",
        "@id",
        "author",
        "timestamp",
        "version",
        "statements"
      ],
      "additionalProperties": false
    }
  },
  "required": [
    "apiVersion",
    "id",
    "component",
    "type",
    "package",
    "platform",
    "owner",
    "createdAt",
    "approval",
    "expiresAt",
    "rationale",
    "references",
    "vex"
  ],
  "additionalProperties": false,
  "allOf": [
    {
      "if": {
        "properties": {
          "component": {
            "const": "reservation-agent"
          }
        }
      },
      "then": {
        "properties": {
          "vex": {
            "properties": {
              "statements": {
                "items": {
                  "properties": {
                    "products": {
                      "items": {
                        "properties": {
                          "@id": {
                            "const": "https://github.com/movie-reservation-platform-lab/movie-reservation-agent"
                          }
                        }
                      }
                    }
                  }
                }
              }
            }
          }
        }
      }
    },
    {
      "if": {
        "properties": {
          "component": {
            "const": "recommendation-service"
          }
        }
      },
      "then": {
        "properties": {
          "vex": {
            "properties": {
              "statements": {
                "items": {
                  "properties": {
                    "products": {
                      "items": {
                        "properties": {
                          "@id": {
                            "const": "https://github.com/movie-reservation-platform-lab/movie-recommendation-service"
                          }
                        }
                      }
                    }
                  }
                }
              }
            }
          }
        }
      }
    },
    {
      "if": {
        "properties": {
          "component": {
            "const": "reservation-mcp"
          }
        }
      },
      "then": {
        "properties": {
          "vex": {
            "properties": {
              "statements": {
                "items": {
                  "properties": {
                    "products": {
                      "items": {
                        "properties": {
                          "@id": {
                            "const": "https://github.com/movie-reservation-platform-lab/movie-reservation-mcp"
                          }
                        }
                      }
                    }
                  }
                }
              }
            }
          }
        }
      }
    },
    {
      "if": {
        "properties": {
          "component": {
            "const": "recommendation-mcp"
          }
        }
      },
      "then": {
        "properties": {
          "vex": {
            "properties": {
              "statements": {
                "items": {
                  "properties": {
                    "products": {
                      "items": {
                        "properties": {
                          "@id": {
                            "const": "https://github.com/movie-reservation-platform-lab/movie-recommendation-mcp"
                          }
                        }
                      }
                    }
                  }
                }
              }
            }
          }
        }
      }
    },
    {
      "if": {
        "properties": {
          "component": {
            "const": "reservation-web"
          }
        }
      },
      "then": {
        "properties": {
          "vex": {
            "properties": {
              "statements": {
                "items": {
                  "properties": {
                    "products": {
                      "items": {
                        "properties": {
                          "@id": {
                            "const": "https://github.com/movie-reservation-platform-lab/movie-reservation-web"
                          }
                        }
                      }
                    }
                  }
                }
              }
            }
          }
        }
      }
    },
    {
      "if": {
        "properties": {
          "type": {
            "const": "not-affected"
          }
        }
      },
      "then": {
        "properties": {
          "vex": {
            "properties": {
              "statements": {
                "items": {
                  "properties": {
                    "status": {
                      "const": "not_affected"
                    }
                  }
                }
              }
            }
          }
        }
      }
    },
    {
      "if": {
        "properties": {
          "type": {
            "const": "risk-accepted"
          }
        }
      },
      "then": {
        "properties": {
          "vex": {
            "properties": {
              "statements": {
                "items": {
                  "properties": {
                    "status": {
                      "const": "affected"
                    }
                  }
                }
              }
            }
          }
        }
      }
    },
    {
      "if": {
        "properties": {
          "component": {
            "const": "reservation-service"
          }
        }
      },
      "then": {
        "properties": {
          "vex": {
            "properties": {
              "statements": {
                "items": {
                  "properties": {
                    "products": {
                      "items": {
                        "properties": {
                          "@id": {
                            "const": "https://github.com/movie-reservation-platform-lab/movie-reservation-service"
                          }
                        }
                      }
                    }
                  }
                }
              }
            }
          }
        }
      }
    }
  ]
}
