{
  "apiVersion": "ci.movie-platform.dev/exemptions/v1alpha1",
  "id": "EX-SYNTHETIC-002",
  "component": "recommendation-mcp",
  "type": "risk-accepted",
  "package": {
    "name": "example-lib",
    "version": "1.2.3-1",
    "purl": "pkg:deb/debian/example-lib@1.2.3-1?arch=amd64&distro=debian-12"
  },
  "platform": {
    "os": "linux",
    "architecture": "amd64"
  },
  "owner": "fixture-service-owner",
  "createdAt": "2026-09-01T00:00:00Z",
  "approval": {
    "by": "fixture-approver",
    "at": "2026-09-01T00:00:00Z",
    "reference": "https://github.com/movie-reservation-platform-lab/movie-platform-actions/pull/123"
  },
  "expiresAt": "2026-10-01T00:00:00Z",
  "rationale": "Synthetic decision for offline tests; not a real approval.",
  "references": [
    "https://example.org/advisories/CVE-2099-10001"
  ],
  "vex": {
    "@context": "https://openvex.dev/ns/v0.2.0",
    "@id": "urn:movie-platform:exemption:EX-SYNTHETIC-002",
    "author": "fixture-approver",
    "timestamp": "2026-09-01T00:00:00Z",
    "version": 1,
    "statements": [
      {
        "vulnerability": {
          "name": "CVE-2099-10001"
        },
        "products": [
          {
            "@id": "https://github.com/movie-reservation-platform-lab/movie-recommendation-mcp",
            "subcomponents": [
              {
                "@id": "pkg:deb/debian/example-lib@1.2.3-1?arch=amd64&distro=debian-12"
              }
            ]
          }
        ],
        "status": "affected",
        "action_statement": "Synthetic fixture only: track an upstream fix and review before expiry."
      }
    ]
  }
}
